{
  "$schema": "https://uixvisor.dev/schema/registry-item.json",
  "name": "app-header",
  "type": "registry:block",
  "version": "0.2.0",
  "title": "App Header",
  "description": "Top-level screen header with optional leading/trailing slots and back affordance.",
  "platforms": ["ios", "android", "web"],
  "compatibility": {
    "expo": ">=57 <58",
    "nativewind": ">=4 <5"
  },
  "dependencies": [],
  "registryDependencies": ["icon", "theme", "text"],
  "files": [
    {
      "source": "app-header.tsx",
      "target": "components/blocks/app-header.tsx"
    }
  ]
}
