{
  "$schema": "https://uixvisor.dev/schema/registry-item.json",
  "name": "button",
  "type": "registry:component",
  "version": "0.2.0",
  "title": "Button",
  "description": "Accessible, themeable button primitive for Expo applications.",
  "platforms": ["ios", "android"],
  "compatibility": {
    "expo": ">=57 <58",
    "nativewind": ">=4 <5"
  },
  "dependencies": [],
  "registryDependencies": ["theme", "spinner"],
  "files": [
    {
      "source": "button.tsx",
      "target": "components/ui/button.tsx"
    }
  ]
}
