{
  "$schema": "https://uixvisor.dev/schema/registry-item.json",
  "name": "checkbox",
  "type": "registry:component",
  "version": "0.1.0",
  "title": "Checkbox",
  "description": "Accessible, themeable checkbox primitive for Expo applications.",
  "platforms": [
    "ios",
    "android"
  ],
  "compatibility": {
    "expo": ">=57 <58",
    "nativewind": ">=4 <5"
  },
  "dependencies": [],
  "registryDependencies": [
    "icon",
    "theme"
  ],
  "files": [
    {
      "source": "checkbox.tsx",
      "target": "components/ui/checkbox.tsx"
    }
  ]
}
