{
  "$schema": "https://uixvisor.dev/schema/registry-item.json",
  "name": "textarea",
  "type": "registry:component",
  "version": "0.2.0",
  "title": "Textarea",
  "description": "Multiline, themeable text input primitive with label and error state for Expo applications.",
  "platforms": ["ios", "android"],
  "compatibility": {
    "expo": ">=57 <58",
    "nativewind": ">=4 <5"
  },
  "dependencies": [],
  "registryDependencies": ["theme", "text"],
  "files": [
    {
      "source": "textarea.tsx",
      "target": "components/ui/textarea.tsx"
    }
  ]
}
