{
  "$schema": "https://uixvisor.dev/schema/registry-item.json",
  "name": "auth-schemas",
  "type": "registry:component",
  "version": "0.2.0",
  "title": "Auth Schemas",
  "description": "Shared Zod schemas for sign-in, sign-up, OTP, and phone login. Compose via form-adapter; never validate in UI with if/else.",
  "platforms": ["ios", "android", "web"],
  "compatibility": {
    "expo": ">=57 <58",
    "nativewind": ">=4 <5"
  },
  "dependencies": ["zod"],
  "registryDependencies": [],
  "files": [
    {
      "source": "auth-schemas.ts",
      "target": "components/forms/auth-schemas.ts"
    }
  ]
}
