{
  "$schema": "https://uixvisor.dev/schema/registry-item.json",
  "name": "text",
  "type": "registry:component",
  "version": "0.2.0",
  "title": "Text",
  "description": "Semantic, themeable text primitive for Expo applications.",
  "platforms": ["ios", "android"],
  "compatibility": {
    "expo": ">=57 <58",
    "nativewind": ">=4 <5"
  },
  "dependencies": [],
  "registryDependencies": ["theme"],
  "files": [
    {
      "source": "text.tsx",
      "target": "components/ui/text.tsx"
    }
  ]
}
