{
  "$schema": "https://uixvisor.dev/schema/registry-item.json",
  "name": "onboarding",
  "type": "registry:flow",
  "version": "0.1.1",
  "title": "Onboarding Flow",
  "description": "Linear onboarding pager: top-right Skip, centered content, full-width footer CTA with progress dots.",
  "platforms": ["ios", "android", "web"],
  "compatibility": {
    "expo": ">=57 <58",
    "nativewind": ">=4 <5"
  },
  "dependencies": [],
  "registryDependencies": ["button", "heading", "text", "theme"],
  "files": [
    {
      "source": "onboarding.tsx",
      "target": "components/flows/onboarding.tsx"
    }
  ]
}
