{
  "$schema": "https://uixvisor.dev/schema/registry-item.json",
  "name": "profile",
  "type": "registry:screen",
  "version": "0.2.0",
  "title": "Profile Screen",
  "description": "Avatar, name, email, optional bio, and host-owned actions slot with optional AppHeader.",
  "platforms": ["ios", "android", "web"],
  "compatibility": {
    "expo": ">=57 <58",
    "nativewind": ">=4 <5"
  },
  "dependencies": [],
  "registryDependencies": ["app-header", "avatar", "heading", "text", "theme"],
  "files": [
    {
      "source": "profile.tsx",
      "target": "components/screens/profile.tsx"
    }
  ]
}
